{
  "id": "OB-14-01",
  "grado": "Operaciones Básicas",
  "numero": 105,
  "categoria": "mult_div",
  "campoFormativo": "Saberes y Pensamiento Científico",
  "eje": "Sentido numérico y pensamiento algebraico",
  "titulo": "Multiplicación de varios dígitos (algoritmo en columna) — Momento 1/8",
  "contenido": "El algoritmo escrito de la multiplicación cuando ambos factores tienen dos o más cifras, usando productos parciales.",
  "pda": "Aplica el algoritmo de la multiplicación en columna con factores de dos o más cifras, sumando correctamente los productos parciales.",
  "problematizacion": {
    "contexto": "Doña Carmen vende naranjas en el mercado sobre Ruiz de bolsas de 23 piezas cada una. Un cliente necesita fruta para el desayuno de toda su familia y decide comprar 3 bolsas completas.",
    "pregunta": "¿Cuántas naranjas se llevó el cliente en total?"
  },
  "subtemas": [
    {
      "numero": "14.1",
      "nivelEtiqueta": "Nivel 1 de 8 · Introductorio",
      "titulo": "Multiplicar por un solo dígito, sin llevar",
      "explicacion": "En la multiplicación en columna, el número más grande se escribe arriba y el multiplicador de una sola cifra se coloca abajo, alineado a la derecha. Se multiplica cada cifra del número de arriba por la cifra de abajo, empezando por las unidades y avanzando hacia la izquierda. Cada resultado se escribe en su propia columna. Cuando ningún producto de cifras pasa de 9, no hay que llevar nada: es el caso más sencillo del algoritmo.",
      "formula": "cifra de arriba × cifra de abajo = cifra del resultado, columna por columna",
      "ejemplos": [
        "23 × 3: unidades 3×3=9, decenas 2×3=6 → 23×3=69",
        "41 × 2: unidades 1×2=2, decenas 4×2=8 → 41×2=82"
      ],
      "puntosPorReactivo": 10,
      "estrellasMax": 3,
      "reactivos": [
        {
          "tipo": "opcion_multiple",
          "pregunta": "¿Cuál es el resultado de 32 × 3?",
          "opciones": [
            "93",
            "96",
            "86",
            "69"
          ],
          "respuestaCorrecta": 1,
          "retroalimentacion": "32×3: unidades 2×3=6, decenas 3×3=9 → 96."
        },
        {
          "tipo": "llenar_frase",
          "frase": "24 × 2 = ___",
          "respuestaCorrecta": "48",
          "retroalimentacion": "Unidades 4×2=8, decenas 2×2=4 → 48."
        },
        {
          "tipo": "verdadero_falso",
          "enunciado": "13 × 3 = 39",
          "respuestaCorrecta": true,
          "retroalimentacion": "13×3: unidades 3×3=9, decenas 1×3=3 → 39. Es correcto."
        },
        {
          "tipo": "algoritmo_columnas",
          "operacion": "multiplicacion",
          "filas": [
            {
              "valor": "23"
            },
            {
              "valor": "3",
              "signo": "×"
            },
            {
              "valor": "69",
              "esResultado": true
            }
          ],
          "ocultos": [
            [
              1
            ],
            [],
            [
              0
            ]
          ],
          "retroalimentacion": "23×3=69: la cifra de unidades del primer factor es 3 (3×3=9 unidades) y la cifra de decenas del resultado es 6 (2×3=6 decenas)."
        },
        {
          "tipo": "opcion_multiple",
          "pregunta": "¿Cuál es el resultado de 34 × 2?",
          "opciones": [
            "86",
            "72",
            "68",
            "62"
          ],
          "respuestaCorrecta": 2,
          "retroalimentacion": "34×2: unidades 4×2=8, decenas 3×2=6 → 68."
        }
      ]
    }
  ]
}