{
  "id": "OB-05-04",
  "grado": "Operaciones Básicas",
  "numero": 36,
  "categoria": "suma_resta",
  "campoFormativo": "Saberes y Pensamiento Científico",
  "eje": "Sentido numérico y pensamiento algebraico",
  "titulo": "Suma y resta de decimales alineando el punto — Momento 4/8",
  "contenido": "Suma y resta de números decimales, cuidando alinear el punto decimal antes de operar columna por columna.",
  "pda": "Suma y resta números decimales alineando correctamente el punto decimal, relacionando el procedimiento con el de los números naturales.",
  "problematizacion": {
    "contexto": "En Puebla, el chofer Rogelio maneja una combi de transporte escolar y anota los kilómetros que recorre cada día para llevar el control del mantenimiento. El lunes recorrió 8.1 km en la ruta de la mañana y el martes recorrió 2.4 km menos que el lunes.",
    "pregunta": "¿Aproximadamente cuántos kilómetros recorrió Rogelio el martes?"
  },
  "subtemas": [
    {
      "numero": "5.4",
      "nivelEtiqueta": "Nivel 4 de 8 · Intermedio",
      "titulo": "Restar decimales pidiendo prestado",
      "explicacion": "Cuando el dígito de arriba en una columna es menor que el de abajo, se pide prestada 1 unidad a la columna de la izquierda, igual que en la resta de números naturales. Esto puede ocurrir en la columna de los décimos o en la de las unidades, y hay que recordar restar 1 a la columna de la que se pidió prestado antes de continuar.",
      "formula": "Si el de arriba es menor, pide prestado 1 a la columna de la izquierda",
      "ejemplos": [
        "6.2 - 3.7: en los décimos 2<7, se pide prestado: 12-7=5; en unidades 6-1-3=2; resultado 2.5",
        "8.1 - 2.4 = 5.7 porque se pide prestado en los décimos (11-4=7) y luego 8-1-2=5"
      ],
      "puntosPorReactivo": 10,
      "estrellasMax": 3,
      "reactivos": [
        {
          "tipo": "opcion_multiple",
          "pregunta": "Resta pidiendo prestado: 6.2 - 3.7 = ?",
          "opciones": [
            "2.5",
            "3.5",
            "2.4",
            "9.9"
          ],
          "respuestaCorrecta": 0,
          "retroalimentacion": "En los décimos 2 es menor que 7, se pide prestado: 12-7=5; en las unidades 6-1-3=2, entonces 6.2 - 3.7 = 2.5."
        },
        {
          "tipo": "verdadero_falso",
          "enunciado": "8.1 - 2.4 = 5.7",
          "respuestaCorrecta": true,
          "retroalimentacion": "Correcto: en los décimos 1<4, se pide prestado: 11-4=7; en unidades 8-1-2=5, entonces 8.1 - 2.4 = 5.7."
        },
        {
          "tipo": "llenar_frase",
          "frase": "9.3 - 5.6 = ___",
          "respuestaCorrecta": "3.7",
          "retroalimentacion": "En los décimos 3<6, se pide prestado: 13-6=7; en unidades 9-1-5=3, entonces 9.3 - 5.6 = 3.7."
        },
        {
          "tipo": "algoritmo_columnas",
          "operacion": "resta",
          "filas": [
            {
              "valor": "6.2"
            },
            {
              "valor": "3.7",
              "signo": "-"
            },
            {
              "valor": "2.5",
              "esResultado": true
            }
          ],
          "ocultos": [
            [],
            [],
            [
              0,
              2
            ]
          ],
          "retroalimentacion": "6.2 - 3.7 = 2.5: se pide prestado en los décimos (12-7=5) y luego 6-1-3=2 en las unidades."
        },
        {
          "tipo": "algoritmo_columnas",
          "operacion": "resta",
          "filas": [
            {
              "valor": "8.1"
            },
            {
              "valor": "2.4",
              "signo": "-"
            },
            {
              "valor": "5.7",
              "esResultado": true
            }
          ],
          "ocultos": [
            [
              0
            ],
            [
              2
            ],
            []
          ],
          "retroalimentacion": "8.1 - 2.4 = 5.7: se pide prestado en los décimos (11-4=7) y en unidades 8-1-2=5."
        }
      ]
    }
  ]
}