{
  "id": "2S-B1-PDA03-09",
  "grado": "2°",
  "trimestre": "1",
  "numero": 29,
  "campoFormativo": "Saberes y Pensamiento Científico",
  "eje": "Sentido numérico y pensamiento algebraico",
  "titulo": "Resolución de problemas de proporcionalidad directa 3.9",
  "contenido": "Resolución de problemas de proporcionalidad directa.",
  "pda": "Resuelve problemas de proporcionalidad directa mediante el valor unitario, la constante de proporcionalidad y otros procedimientos.",
  "problematizacion": {
    "contexto": "Una receta de pan de muerto usa 250 gramos de harina por cada 6 piezas, y cada 100 gramos de harina cuestan $3.50 en la tienda de abarrotes. La panadera Rosalinda quiere calcular cuánto le costará la harina para hacer 24 piezas de pan.",
    "pregunta": "¿Cuánto le costará la harina a Rosalinda para hacer 24 piezas de pan de muerto?"
  },
  "subtemas": [
    {
      "numero": "3.9",
      "nivelEtiqueta": "Nivel 9 de 10 · Integración",
      "titulo": "Cadenas de proporcionalidad: de la receta al presupuesto",
      "explicacion": "Estos problemas combinan DOS relaciones de proporcionalidad directa encadenadas: por ejemplo, de porciones a gramos de ingrediente y de gramos a costo, o de horas trabajadas a dinero ganado y de dinero ganado a ahorro. Debes identificar y aplicar más de una constante k en el mismo problema, a veces convirtiendo unidades entre un paso y otro (como gramos a kilogramos).",
      "ejemplos": [
        "Una receta para 8 porciones usa 320 g de harina, y la harina cuesta $12 el kg. Para 20 porciones: primero k₁ = 320÷8 = 40 g por porción, así que 20 porciones necesitan 20×40 = 800 g = 0.8 kg. Después, el costo es 0.8 × 12 = $9.60.",
        "Un albañil gana $180 por cada 3 horas trabajadas, así que k₁ = 180÷3 = $60 por hora. Si trabaja 4.5 horas gana 4.5×60 = $270. Si ahorra el 20% (k₂ = 0.2) de lo ganado, ahorra 270×0.2 = $54."
      ],
      "puntosPorReactivo": 10,
      "estrellasMax": 3,
      "reactivos": [
        {
          "tipo": "opcion_multiple",
          "pregunta": "Una receta para 6 personas usa 450 g de arroz. Si preparas la receta para 10 personas, ¿cuántos gramos de arroz necesitas?",
          "opciones": [
            "650 g",
            "700 g",
            "750 g",
            "800 g"
          ],
          "respuestaCorrecta": 2,
          "retroalimentacion": "k = 450 ÷ 6 = 75 g por persona. 10 × 75 = 750 g."
        },
        {
          "tipo": "llenar_frase",
          "frase": "Siguiendo la receta anterior (750 g de arroz para 10 personas), si el arroz cuesta $24 el kg, ¿cuánto cuesta el arroz necesario? Respuesta: $___",
          "respuestaCorrecta": "18",
          "retroalimentacion": "750 g = 0.75 kg. 0.75 × 24 = $18."
        },
        {
          "tipo": "opcion_multiple",
          "pregunta": "Un obrero gana $84 por cada 4 horas de trabajo. Si trabaja 7 horas, ¿cuánto gana?",
          "opciones": [
            "$133",
            "$140",
            "$147",
            "$154"
          ],
          "respuestaCorrecta": 2,
          "retroalimentacion": "k = 84 ÷ 4 = $21 por hora. 7 × 21 = $147."
        },
        {
          "tipo": "llenar_frase",
          "frase": "Siguiendo el problema anterior, si el obrero ahorra la cuarta parte (25%) de los $147 que ganó, ¿cuánto ahorra? Respuesta: $___",
          "respuestaCorrecta": "36.75",
          "retroalimentacion": "147 × 0.25 = $36.75."
        },
        {
          "tipo": "opcion_multiple",
          "pregunta": "Una tienda vende manzanas a $32 el kg. Una receta requiere 3 manzanas por cada 500 g, y necesitas 9 manzanas. ¿Cuántos kg de manzanas debes comprar?",
          "opciones": [
            "1.2 kg",
            "1.5 kg",
            "1.8 kg",
            "2 kg"
          ],
          "respuestaCorrecta": 1,
          "retroalimentacion": "k = 500 ÷ 3 ≈ 166.67 g por manzana. 9 × 166.67 = 1,500 g = 1.5 kg."
        },
        {
          "tipo": "llenar_frase",
          "frase": "Con la compra de 1.5 kg de manzanas del problema anterior (a $32 el kg), ¿cuánto pagarás en total? Respuesta: $___",
          "respuestaCorrecta": "48",
          "retroalimentacion": "1.5 × 32 = $48."
        },
        {
          "tipo": "verdadero_falso",
          "enunciado": "Una fábrica de playeras usa 1.5 m de tela por playera, y la tela cuesta $60 el metro. Para producir 20 playeras se necesitan 30 m de tela, con un costo de $1,800.",
          "respuestaCorrecta": true,
          "retroalimentacion": "1.5 × 20 = 30 m de tela. 30 × 60 = $1,800."
        },
        {
          "tipo": "relacionar_columnas",
          "instruccion": "Una receta usa 240 g de azúcar por cada 4 porciones. Relaciona cada cantidad de porciones con el costo del azúcar necesario, si el azúcar cuesta $18 el kg.",
          "columnaA": [
            "10 porciones",
            "6 porciones",
            "16 porciones"
          ],
          "columnaB": [
            "$6.48",
            "$17.28",
            "$10.80"
          ],
          "parejasCorrectas": [
            2,
            0,
            1
          ],
          "retroalimentacion": "Azúcar por porción: 240÷4=60 g. 10 porciones=600 g=0.6 kg→$10.80. 6 porciones=360 g=0.36 kg→$6.48. 16 porciones=960 g=0.96 kg→$17.28."
        },
        {
          "tipo": "opcion_multiple",
          "pregunta": "Un ciclista pedalea a 20 km/h constantes durante 3 horas. Por cada 5 km recorridos quema 150 kcal, de forma proporcional a la distancia. ¿Cuántas kcal quema en total durante las 3 horas?",
          "opciones": [
            "1,500 kcal",
            "1,650 kcal",
            "1,800 kcal",
            "2,100 kcal"
          ],
          "respuestaCorrecta": 2,
          "retroalimentacion": "Distancia = 20 × 3 = 60 km. k = 150÷5 = 30 kcal por km. 60 × 30 = 1,800 kcal."
        },
        {
          "tipo": "llenar_frase",
          "frase": "Una fábrica produce 240 piezas en 8 horas, a ritmo constante, y cada pieza requiere 250 g de plástico. ¿Cuántos KILOGRAMOS de plástico se necesitan para la producción de 5 horas? Respuesta: ___ kg",
          "respuestaCorrecta": "37.5",
          "retroalimentacion": "Piezas en 5 h: 240÷8=30 piezas por hora; 5×30=150 piezas. Plástico: 150×250 g = 37,500 g = 37.5 kg."
        }
      ]
    }
  ],
  "practicaExtra": [
    {
      "tipo": "llenar_frase",
      "frase": "Si 9 boletos de feria cuestan $162, entonces 14 boletos cuestan $___.",
      "respuestaCorrecta": "252",
      "retroalimentacion": "k = 162÷9 = 18 por boleto. 14×18 = $252."
    },
    {
      "tipo": "verdadero_falso",
      "enunciado": "Una receta usa 5 tazas de harina para 30 galletas. Para 42 galletas se necesitan 7 tazas.",
      "respuestaCorrecta": true,
      "retroalimentacion": "Correcto: k = 5÷30 = 1/6 de taza por galleta; 42×1/6 = 7 tazas."
    },
    {
      "tipo": "relacionar_columnas",
      "instruccion": "Relaciona cada situación con su constante de proporcionalidad (k).",
      "columnaA": [
        "8 metros de tela cuestan $328",
        "6 kg de jamón cuestan $390",
        "10 boletos de autobús cuestan $150"
      ],
      "columnaB": [
        "$15 por boleto",
        "$65 por kg",
        "$41 por metro"
      ],
      "parejasCorrectas": [
        2,
        1,
        0
      ],
      "retroalimentacion": "8 metros de tela cuestan $328 → $41 por metro; 6 kg de jamón cuestan $390 → $65 por kg; 10 boletos de autobús cuestan $150 → $15 por boleto."
    },
    {
      "tipo": "llenar_frase",
      "frase": "Si 4 kg de arroz cuestan $88, entonces 7 kg cuestan $___.",
      "respuestaCorrecta": "154",
      "retroalimentacion": "k = 88÷4 = 22 por kg. 7×22 = $154."
    }
  ]
}