{
  "id": "2S-B1-PDA02-02",
  "grado": "2°",
  "trimestre": "1",
  "numero": 12,
  "campoFormativo": "Saberes y Pensamiento Científico",
  "eje": "Sentido numérico y pensamiento algebraico",
  "titulo": "Extensión del significado de las operaciones y sus relaciones inversas 2.2",
  "contenido": "Extensión del significado de las operaciones y sus relaciones inversas.",
  "pda": "Comprueba y argumenta si las operaciones cumplen las propiedades conmutativa, asociativa y distributiva. Aplica criterios de divisibilidad, máximo común divisor y mínimo común múltiplo.",
  "problematizacion": {
    "contexto": "En una unidad deportiva de Guadalajara, un camión que lleva niños a natación pasa cada 18 minutos y otro que lleva niños a futbol pasa cada 24 minutos; ambos salieron juntos de la unidad a las 7:00 de la mañana.",
    "pregunta": "¿Después de cuántos minutos volverán a salir juntos los dos camiones?"
  },
  "subtemas": [
    {
      "numero": "2.2",
      "titulo": "Mínimo común múltiplo (mcm)",
      "explicacion": "El mínimo común múltiplo (mcm) es el menor número que es múltiplo de ambos números a la vez. Sirve para sincronizar eventos que se repiten con distinta frecuencia, como saber cada cuántos días coinciden dos actividades.",
      "formula": "mcm(24,36) = 72",
      "ejemplos": [
        "Múltiplos de 4: 4, 8, 12, 16... Múltiplos de 6: 6, 12, 18, 24... El menor común es 12, así que mcm(4,6)=12."
      ],
      "puntosPorReactivo": 10,
      "estrellasMax": 3,
      "reactivos": [
        {
          "tipo": "llenar_frase",
          "frase": "El MCD de 18 y 30 es ___.",
          "respuestaCorrecta": "6",
          "retroalimentacion": "18=2×3², 30=2×3×5. MCD = 2×3 = 6."
        },
        {
          "tipo": "llenar_frase",
          "frase": "El mcm de 54 y 30 es ___.",
          "respuestaCorrecta": "270",
          "retroalimentacion": "mcm(54,30) = 270."
        },
        {
          "tipo": "llenar_frase",
          "frase": "El MCD de 32 y 18 es ___.",
          "respuestaCorrecta": "2",
          "retroalimentacion": "MCD(32,18) = 2."
        },
        {
          "tipo": "llenar_frase",
          "frase": "El MCD de 49 y 31 es ___.",
          "respuestaCorrecta": "1",
          "retroalimentacion": "MCD(49,31) = 1."
        },
        {
          "tipo": "llenar_frase",
          "frase": "El mcm de 33 y 34 es ___.",
          "respuestaCorrecta": "1122",
          "retroalimentacion": "mcm(33,34) = 1122."
        },
        {
          "tipo": "opcion_multiple",
          "pregunta": "¿Cuál es el mcm de 9 y 15?",
          "opciones": [
            "45",
            "135",
            "30",
            "15"
          ],
          "respuestaCorrecta": 0,
          "retroalimentacion": "mcm(9,15) = 45."
        },
        {
          "tipo": "verdadero_falso",
          "enunciado": "El MCD de 45 y 60 es 15.",
          "respuestaCorrecta": true,
          "retroalimentacion": "Correcto: 45=3²×5, 60=2²×3×5. MCD = 3×5 = 15."
        },
        {
          "tipo": "verdadero_falso",
          "enunciado": "El mcm de 8 y 20 es 80.",
          "respuestaCorrecta": false,
          "retroalimentacion": "Falso: mcm(8,20) = 40, no 80."
        },
        {
          "tipo": "llenar_frase",
          "frase": "El MCD de 42 y 56 es ___.",
          "respuestaCorrecta": "14",
          "retroalimentacion": "42=2×3×7, 56=2³×7. MCD = 2×7 = 14."
        },
        {
          "tipo": "relacionar_columnas",
          "instruccion": "Relaciona cada operación con su resultado.",
          "columnaA": [
            "MCD de 24 y 36",
            "mcm de 4 y 10",
            "MCD de 15 y 22"
          ],
          "columnaB": [
            "1",
            "20",
            "12"
          ],
          "parejasCorrectas": [
            2,
            1,
            0
          ],
          "retroalimentacion": "MCD de 24 y 36 = 12; mcm de 4 y 10 = 20; MCD de 15 y 22 = 1."
        }
      ],
      "nivelEtiqueta": "Nivel 2 de 10 · Intermedio"
    }
  ],
  "practicaExtra": [
    {
      "tipo": "verdadero_falso",
      "enunciado": "El mcm de 9 y 12 es 108.",
      "respuestaCorrecta": false,
      "retroalimentacion": "Falso: mcm(9,12) = 36, no 108."
    },
    {
      "tipo": "opcion_multiple",
      "pregunta": "¿Cuál es el MCD de 40 y 60?",
      "opciones": [
        "10",
        "20",
        "40",
        "5"
      ],
      "respuestaCorrecta": 1,
      "retroalimentacion": "MCD(40,60) = 20."
    },
    {
      "tipo": "llenar_frase",
      "frase": "El MCD de 54 y 36 es ___.",
      "respuestaCorrecta": "18",
      "retroalimentacion": "54=2×3³, 36=2²×3². MCD = 2×3² = 18."
    },
    {
      "tipo": "llenar_frase",
      "frase": "El mcm de 8 y 14 es ___.",
      "respuestaCorrecta": "56",
      "retroalimentacion": "8=2³, 14=2×7. mcm = 2³×7 = 56."
    }
  ]
}