{
  "id": "OB-29-01",
  "grado": "Operaciones Básicas",
  "numero": 225,
  "categoria": "potencias_raices",
  "campoFormativo": "Saberes y Pensamiento Científico",
  "eje": "Sentido numérico y pensamiento algebraico",
  "titulo": "Significado de la potencia (multiplicación repetida) — Momento 1/8",
  "contenido": "La potencia como una multiplicación repetida de un mismo factor (base), identificando base y exponente.",
  "pda": "Interpreta una potencia como la multiplicación repetida de su base, e identifica base y exponente en una expresión.",
  "problematizacion": {
    "contexto": "En la tiendita de la escuela, la maestra Lupita escribió en el pizarrón el precio de una promoción como 5^2 pesos para explicar cómo se leen las potencias antes de calcular su valor. Varios alumnos se confundieron y no supieron qué número era cuál.",
    "pregunta": "En la expresión 5^2 que escribió la maestra Lupita, ¿cuál número es la base y cuál es el exponente?"
  },
  "subtemas": [
    {
      "numero": "29.1",
      "nivelEtiqueta": "Nivel 1 de 8 · Introductorio",
      "titulo": "¿Qué es la base y qué es el exponente?",
      "explicacion": "Una potencia tiene dos partes: la base, que es el número que se multiplica, y el exponente, que indica cuántas veces se repite esa multiplicación. Por ejemplo, en 6^4 el 6 es la base y el 4 es el exponente. El exponente se escribe más pequeño y arriba a la derecha de la base. Antes de calcular cualquier potencia, siempre conviene identificar primero cuál número es la base y cuál es el exponente.",
      "formula": "base^exponente",
      "ejemplos": [
        "En 7^3, la base es 7 y el exponente es 3; significa que el 7 se multiplica 3 veces (7×7×7).",
        "En 2^5, la base es 2 y el exponente es 5; significa que el 2 se multiplica 5 veces (2×2×2×2×2)."
      ],
      "puntosPorReactivo": 10,
      "estrellasMax": 3,
      "reactivos": [
        {
          "tipo": "opcion_multiple",
          "pregunta": "En la potencia 6^4, ¿cuál es la base?",
          "opciones": [
            "4",
            "6",
            "24",
            "10"
          ],
          "respuestaCorrecta": 1,
          "retroalimentacion": "La base es el número que se repite al multiplicar, en este caso el 6. El 4 es el exponente."
        },
        {
          "tipo": "opcion_multiple",
          "pregunta": "En la potencia 9^2, ¿cuál es el exponente?",
          "opciones": [
            "9",
            "2",
            "18",
            "81"
          ],
          "respuestaCorrecta": 1,
          "retroalimentacion": "El exponente indica cuántas veces se repite la base; aquí es el 2, porque el 9 se multiplica 2 veces."
        },
        {
          "tipo": "llenar_frase",
          "frase": "En la potencia 3^5, el exponente es ___.",
          "respuestaCorrecta": "5",
          "retroalimentacion": "El número que va arriba a la derecha de la base es el exponente; en 3^5 ese número es el 5."
        },
        {
          "tipo": "verdadero_falso",
          "enunciado": "En la potencia 8^3, la base es 3.",
          "respuestaCorrecta": false,
          "retroalimentacion": "Falso. La base es el 8, porque es el número que se multiplica; el 3 es el exponente."
        },
        {
          "tipo": "relacionar_columnas",
          "instruccion": "Relaciona cada potencia con su base correcta.",
          "columnaA": [
            "4^2",
            "7^3",
            "10^4",
            "2^6"
          ],
          "columnaB": [
            "base 10",
            "base 4",
            "base 2",
            "base 7"
          ],
          "parejasCorrectas": [
            1,
            3,
            0,
            2
          ],
          "retroalimentacion": "La base siempre es el número escrito en tamaño normal, antes del exponente: 4^2 tiene base 4, 7^3 tiene base 7, 10^4 tiene base 10 y 2^6 tiene base 2."
        }
      ]
    }
  ]
}